Komentar,Sentimen
 Jokowi Negara Besar Resesi Ekonomi Indonesia Tumbuh ,Negatif
 Banyak PHK Dampak Resesi Global Indonesia Sudah Terasa LengkapCepatBeritanya Keuangan Ekonomi Ekonomi EkonomiIndonesia ,Positif
 indonesia tidak mengenal resesi sexs buktinya masih banyak orang hajatan ,Positif
 Ekonomi syariah memang menjadi daya tarik tengah isu resesi dan depresi ekonomi kapitalisme saat ini Terlebih Indonesia memiliki potensi besar untuk berkembangnya ekonomi syariah ,Positif
 negaranya mungkin kena dampak resesi global beruntung tinggal indonesia tidak besar dampak nya ,Negatif
 Ekonomi syariah memang jadi daya tarik tengah isu resesi dan depresi ekonomi kapitalisme saat ini Indonesia memiliki potensi besar berkembangnya ekonomi syariah IslamKaffah simak videonya Serba serbi MMC ,Positif
 Ini yang sdh banyak orang tahu Usahakan dapat tambahan penghasilan nJadi resesi apa tidak nDunia mungkin resesi Indonesia mungkin tidak nTdk ada yang tahu pasti nYg pasti kita perlu siap nSemoga bermanfaat Resesi ,Positif
 Menurut Google wapres kita dulu jadi saksi yang memberatkan Ahok yang sesumbar bilang Indonesia bebas covid karena doa qunut kemarin bilang Indonesia bakal kebal resesi karena wali doa dan wirid ,Positif
 Ngiritiknya mas Rizal sdh berkurang bobotnya skrg pertumbuhan ekonomi Indonesia disaat dunia lagi resesi coba beri masukan bgmn caranya agar pertumbuhan ekonomi Indonesia bisa jadi Ditunggu komennya Mas ,Positif
 Cuma indonesia gak resesi jadi hayoo gass jajannyaa Disimpen takkut bgt mati pade zinah aja bangga ,Negatif
 Pemerintah perlu memikirkan solusi yang lebih holistik untuk memastikan sektor industri Indonesia tetap terjaga terutama tengah ancaman resesi dunia yang saat ini kita hadapi arsjadrasjid UUCiptaker inklusifkolaboratif ,Negatif
 Klaim Ekonomi Indonesia Tumbuh Saat Negara Lain Resesi Jokowi Bukannya Sombong Kita Itu Dipuji Mana mana ,Positif
 Dihadapan Relawan Jokowi Negara Besar Saat Ini Resesi Ekonomi Indonesia Tumbuh ,Positif
 Ekonom IAEI Sebut Indonesia Mampu Atasi Ancaman Resesi ,Positif
 Berkacalah dunia luar yang notabene banyak negara sudah mengalami resesi akibat krisis ekonomi global nBersyukurlah indonesia masih bisa bertahan sampai sekarang nSaya itu memenang bodoh dan sekolah tinggi sepintar anda ,Positif
 Keberhasilan atau Kesuksesan itu ada tolak ukurnya Dunia mengajui Indonesia bisa menjadi role model dunia lolos Dari resesi nJangan terpengaruh oleh orang bernarasi dari textbook yang terpengaruh dengan perasaannya ,Positif
 Pamer Keberhasilan Jokowi Negara Besar Resesi Tapi Ekonomi Indonesia Tumbuh Persen beritajogja jogja jogjaistimewa ,Negatif
 Rusia Resmi Resesi Indonesia harus Hati Hati ,Positif
 Jangan takut Indonesia kolaps keterjang resesi dunia Indonesia akan bubar dengan sendirinya kalo RUU KUHP jadi ,Negatif
 elo bisa mkn idup hingga ini dan indonesia baik aja tanpa resesi itu mana nyuk ,Positif
 Walaupun demikian kita berharap pada kuartal selanjutnya indeks UMKM dapat terus meningkat agar perekonomian Indonesia juga dapat meningkat dan terhindar dari resesi KinerjaBRIQ ,Negatif
 Katanya nanti bakal gelap banget lho karena resesi nDi sih emang udah kejadian terus Indonesia sendiri kondisinya gimana nSo far sih masih aman tapi gak ada salahnya buat prepare kalo emang nanti kejadian ,Negatif
 Mungkin seperti inilah cara indonesia selamat dari resesi ,Negatif
 Saat banyak negara mengalami resesi ekonomi Indonesia dibawah kepemimpinan presiden Jokowi justru mampu bertumbuh padahal tekanan begitu berat ada pandemi ada perang Rusia Ukraina Kita mampu hadapi nHasil tak mengkhianati kerja keras NYATA ,Positif
 Arsjad Rasjid menyebut Indonesia membutuhkan solusi holistik bersama pemerintah agar pendekatan yang dilakukan dalam menghadapi gelombang PHK ini tidak sampai menggerus optimisme dal menghadapi ancaman resesi depan afterb arsjadrasjid upahminimum inklusifkolaboratif ,Positif
 Tengah Resesi Global Presiden Sebut Ekonomi Indonesia Tumbuh Persen ,Positif
 Presiden Jokowi Ekonomi Indonesia tumbuh persen saat resesi global ,Positif
 Sekarang Waktunya Ekonomi Indonesia Anti Resesi Indonesia telah disebut kebal terhadap resesi mendatang BPS menyebut bahwa indonesia anti resesi san pertumbuhan ekonomi Indonesia triwulan ,Positif
 Beberapa Negara Mengalami Ancaman Resesi Bagaimana Indonesia Anak Muda Ini Hal Terbaik yang Bisa Dilakukan ,Positif
 Jokowi Ungkap Pembangunan Infrastruktur Membuahkan Hasil Hindari Indonesia dari Resesi ,Positif
 Presiden Joko Widodo beberkan capaian ekonomi Indonesia tengah resesi global menyebut capaian tersebut dipuji puji oleh pemimpin negara lain minta agar pemimpin selanjutnya bisa melanjutkan reputasi global dan pembangunan masa tersebut ,Positif
 Jangan berandai andai itu opung andaikan bener resesi ogah mampir atap covid udah bebas Indonesia opung ,Positif
 Pengamat Indonesia Jauh dari Risiko Resesi ,Positif
 Masyarakat Indonesia diminta Jokowi tetap terus waspada karena ancaman resesi global sulit diprediksi ,Positif
 bakal takut namanya resesi Pemerintah sudah memikirkan secara matang agar Indonesia siap hadapi resesi JokowiPresidenku PembangunanUntukRakyat PresidenJokowiHebat JokowiMembangunNegeri JokowiMajuBersamaIndonesia JokowiBapakInfrastruktur ,Positif
 Negara lain Alami Resesi Jokowi Ingatkan Indonesia mesti Waspada Terbaru alami berita indonesia ,Positif
 Populer ruf Amin Indonesia Selamat dari Resesi Karena Ulamanya sangat banyak Berdoa dan juga Wirid Video amin banyak berdoa ,Positif
 Jokowi Ditengah Resesi Global Ekonomi Indonesia Tetap Tumbuh Persen ,Negatif
 Negara Lain Alami Resesi Jokowi Ingatkan Indonesia Harus Waspada ,Positif
 Dalam kondisi resesi ekonomi global itu banyak negara dunia kesulitan Beruntungnya Indonesia masih bisa mengendalikan keadaan ekonomi yang tidak pasti tersebut ,Positif
 Jokowi Negara Besar Resesi Ekonomi Indonesia Tumbuh BeritaSatu MediaInformasi OmKamidi ,Positif
 Pengamat Indonesia Tidak Akan Resesi ,Positif
 Presiden Ekonomi Indonesia Tumbuh Persen Tengah Resesi Global ,Positif
 Jokowi Sebut Negara negara Besar Resesi Indonesia Mampu Tumbuh Persen sariagri pertanian ,Negatif
 Berharap ekonomi Indonesia dan dunia menjadi lebih baik meskipun banyak yang meramalkan adanya resesi Tetap semangat dan terus berjuang kadinjabar kadinkarasa kamardagangindustri kadinjabardaily informasiterupdate umkmnaikkelas ,Negatif
 Presiden Ekonomi Indonesia Tumbuh Saat Resesi Global ,Positif
 Indonesia Aman Dari Ancaman Resesi Katanya Sih Begitu ,Positif
 Nah udah jelas brarti tugas utama dia dijalankan yaitu ngurus negara Kalo dijalanin mngkn kita skrg dah ikut negara lain kena resesi Bersyukur lah dgn nikmat diberikan Indonesia skrg tinggal kita jga tikus koruptor ,Positif
 Pengamat Indonesia jauh dari risiko resesi ,Positif
 Presiden Joko Widodo Jokowi mengatakan negara negara besar resesi namun Indonesia bisa tumbuh kuartal ketiga ,Positif
 Ancaman Resesi Semakin Nyata Bagaimana Strategi Indonesia ,Positif
 Presiden Jokowi Negara Besar Resesi Tapi Ekonomi Indonesia Tumbuh Persen ,Positif
 kata orang indonesia resesi artinya kan ekonomi slowdown masyarakat gapunya duit kan ini ngapa udh seminggu gua hunting kek org gila buat beli ginian gabisa miliar cuma itungan detik abis kan sinting ,Negatif
 Udah duet Prabowo atau Prabowo pasti menang telak pilpres putaran Indonesia adem dan bisa lewati resesi ,Positif
 Indonesia Masih Aman dari Ancaman Resesi Global ,Positif
 Eks Ketua Wantimpres Indonesia Aman dari Ancaman Resesi Global Terbaru aman ancaman ,Positif
 Resesi Global Mengancam Ekonom Indonesia Masih Aman ,Positif
 Punya Pangsa Pasar Ekonomi yang Besar Indonesia Dinilai Masih Aman dari Ancaman Resesi Global ,Positif
 Indonesia masih aman dari ancaman resesi global ,Positif
 Top News Koran Rakyat Merdeka nWapres Sebut Indonesia Kebal Resesi Karena Doa Wali nResesi Itu Prediksi Manusia Urusan Rezeki Allah Yang Atur ,Negatif
 Sejujurnya kalo dilihat Indonesia ini memang terlalu terdampak resesi global Sudah beberapa bulan ini cari undervalued discount property yang dijual ketemu juga Property agent kebanyakan nawarin cluster baru atau balik barang investor juga ,Negatif
 Indonesia bener bener jauh dari kata resesi global nAlias nMaret tahun depan banyak banget event musik Jakarta dari musisi top tier luar negeri xaf ,Negatif
 Pengamat sebut Indonesia masih aman dari ancaman resesi global Terbaru aman ancaman ,Positif
 Hitung mundur resesi Dugaan saldo tembus Triliunan uang tunai illegal masuk Indonesia Rupiah Palsu Melejit ,Positif
 Dengan tingginya nilai produksi komoditi pangan dalam negeri LaNyalla yakin Indonesia akan mampu melewati masa masa sulit dalam npelambatan ekonomi lanyalla resesi ,Positif
 Percayalah Indonesia Aman dari Ancaman Resesi Global ,Positif
 Percayalah Indonesia Aman dari Ancaman Resesi Global Resesiglobal ,Positif
 ancaman resesi dan dampaknya bagi indonesia ,Positif
 Pengamat Indonesia Masih Aman dari Ancaman Resesi global ,Positif
 Pengamat sebut Indonesia masih aman dari ancaman resesi global ,Negatif
 Miliki Pangsa Pasar Besar Indonesia Aman Dari Ancaman Resesi Global ,Negatif
 Eks Wantimpres Indonesia Masih Aman dari Ancaman Resesi Global ,Negatif
 Untuk tahun depan saya memastikan kerja kerja prioritas penanganan banjir pengendalian kemacetan dan antisipasi resesi ekonomi dari Pemprov DKI akan lebih digalakkan nMenuju Jakarta yang lebih baik maju sejahtera dan makmur warganya nSukses Jakarta untuk Indonesia ,Negatif
 lihat amerika sekarang banyak warganya menggelandang punya rumah dan susah makan indonesia pongah kita diberikan pakar ekonomi handal dlm itu negara mana menjamin pdbnya akan baik terjadi resesi dunia global ,Positif
 Rakyat indonesia cerdas ngene kok mau kena resesi ,Positif
 Resesi Arsjad Rasjid Fundamental Ekonomi Indonesia Masih Kuat TrenAsia ,Positif
 Bisa lapor Pak Menteri Pendidikan kasian Pak President sedang pusing mikirin gimana Indonesia thn keluar dari cengkeraman Resesi ,Positif
 Faisal Basri Tahun Depan Indonesia Tidak Resesi lewat ,Positif
 Wapres ruf Amin meyakini Indonesia tak akan kena resesi Salah satunya karena banyak wali yang doa dan wirid kumparanBISNIS DailyUpdate ,Positif
 Rakyat indonesia sangar ngene kok mosok enek resesi bingung ,Positif
 Dan Indonesia diyakini tidak akan mengalami resesi hal telah tergambar dari proyeksi pertumbuhan ekonomi tahun depan JokowiHebat JokowiBapakInfrastruktur harigurunasional ,Positif
 chat aja topiknya dampak resesi global terhadap indonesia ,Negatif
 Bye Resesi nEkonomi Tumbuh Tahun Ini nPertumbuhan ekonomi Indonesia telah mencapai pada tahun ini tengah ekonomi global yang tengah dibayangi resesi JokowiHebat ,Positif
 Melihat berita ini yang hampir tiap hari melintas beranda saya saya benar sangat bersyukur bisa lahir hidup dan bagian dari Negara Indonesia Dimana negara ini masih bisa bertahan ditengah keterpurukan ekonomi dunia Indonesia adh salah satu negara tdk kenal resesi ,Negatif
 Maruf Amin Yakin Indonesia Tak Bakal Alami Resesi karena Banyak Wali yang Suka Berdoa dan Wirid via ,Positif
 Sektor UMKM merupakan perisai bisa menghadapi ketika terjadi tekanan ataupun resesi ekonomi Maklumlah gaes serapan tenaga kerja Indonesia berada pada UMKM khususny sektor mikro KinerjaBRIQ ,Positif
 Saksikan podcast terbaru pekan ini dengan tema Harus Siap apa Hadapi Resesi bersama Host Gilang Bhaskara dan Narasumber dari Manulife Indonesia William Soetrisno Premier hanya Youtube Manulife Indonesia nLink Tayang ,Positif
 Indonesia sdh harus bersiap krn tahun ini Indonesia didapuk sebagai ketua ASEAN tentu ini bentuk kepercayaan masyarakat ASEAN akan kemampuan Indonesia Khususnya dlm menghadapi masa Resesi akan dihadapi dunia thn depan JokowiPemimpinGlobal ,Positif
 Laporan Khusus Muncul Resesi Dunia Bangkitlah UMKM Indonesia sariagri pertanian ,Positif
 Hadapi Resesi Global Ketua DPD Minta Produksi Komoditas Lokal Ditingkatkan nSURABAYA Ancaman resesi global harus menjadi prioritas program kerja pemerintah akhir dan awal tahun depan Mitigasi dan antisipasi harus cermat lanyalla LaNyalla Indonesia ,Positif
 Jauh dari Jurang Resesi Ekonomi Indonesia Masih Bullish ,Positif
 Resesi semakin dekat bisnis semakin bersaing nBiasanya kita import barang dari luar kemudian jual Indonesia nSekarang orang luar datang Indonesia kemudian import barang mereka dari pabrik mereka diluar Indonesia nTerus cara saya bersaing bagaimana caranya ,Positif
 Selama ini rakyat Indonesia happy happy walaupun dunia menghadapi resesi global cuma tdk suka presiden Jokowi kebanyakan keluh kesahnya kurang ini kek kurang itu kek emangnya presiden Jokowi kakekmu semua masalah loe diturutin yaa tidaklah makanya orang ikhlas ,Positif
 Kota Bogor kota hujan nKota paling jauh itu Bekasi nPenerimaan dari PNBP menggembirakan nTanda Indonesia siap hadapi ancaman resesi nupdate APBN APBNKita per nPNBP SDA Migas nPNBP SDA Non Migas nPNBP KND nPNBP Lainnya nPendapatan BLU ,Negatif
 nanyak nii skrg kyknya isu resesi gembar gemborkan apa ada kemungkinan rekayasa biar jabatan tertinggi perpanjang Info penjelasan FIFAWorldCup indonesia ,Positif
 Wapres ruf Amin yakin ekonomi Indonesia tak jatuh seperti negara negara lain karena banyak wali atau alim ulama yang kerap berdoa dan wirid nakibat saya sudah mengganti makan saya dari nasi menjadi pisang akhirnya saya kebal resesi ,Positif
 Pemerintah perlu memikirkan solusi yang lebih holistik untuk memastikan sektor industri Indonesia tetap terjaga terutama tengah ancaman resesi dunia yang saat ini kita hadapi arsjadrasjid kadinindonesia inklusifkolaboratif ,Positif
 xad xbc xba xbc xbb xae Indonesia xae kemungkinan masih jauh dari resesi xbc xba xbc xbb xaf IKNMajukanSektorUMKM IKNMajukanSektorUMKM ,Positif
 Para Ekonom Pengangguran Harap Tenang Dilarang Berisik xbc xef nMenteri Keuangan Sri Mulyani Indrawati mengungkapkan pertumbuhan ekonomi Indonesia telah mencapai pada tahun ini tengah ekonomi global yang tengah dibayangi resesi ,Positif
 Indonesia kemungkinan masih jauh dari resesi IKNMajukanSektorUMKM ,Positif
 Indonesia kemungkinan jauh dari resesi IKNMajukanSektorUMKM ,Positif
 Badai pandemi covid saja bisa kita hadapi apalagi resesi Mari kita jaga daya beli terhadap produk produk UMKM agar bangsa ini tahan resesi global dan UMKM tetap jaya nLove tweet ini dukung UMKM Indonesia tetenmasduki kemenkopukm padiumkm resesi resesiglobal ,Positif
 Kebayang kalo ada skripsi judulnya pengaruh banyaknya wali doa dan wirid terhadap resesi ekonomi Indonesia Ini pembimbing gue langsung gideg sih ,Positif
 Antisipasi Resesi Global Kader PDIP Depok Bercocok Tanam Kebun Rakyat nKader Partai Demokrasi Indonesia Perjuangan PDIP Kota Depok melakukan cocok tanam wilayah Tapos Minggu November ,Positif
 Seharusnya pemerintah memikirkan solusi yang lebih holistik utk memastikan sektor industri Indonesia tetap terjaga tengah ancaman resesi arsjadrasjid kadinindonesia inklusifkolaboratif ,Positif
 Prestasi Jawa Tengah kian melejit dibawah kepemimpinan Ganjar delegasi Swiss sepakat kerjasama hadapi resesi dunia FIFAWorldCup nKorsel Pagii Jepang Haji Muhammad Son Indonesia pengendalian imei Diogo Costa Cianjur First Love Brazil Selamat Hari Guru Japan ,Negatif
 Sayangnya gak spesifik isu apa dimaksud Pak Komjen Agus nIsu Denis selingkuh sama lakinya Ayu Dewi Isu ekonomi Indonesia resesi Isu LGBT Piala Dunia Atau isu Hitler mati Garut ,Positif
 Ganjar Pranowo memiliki strategi tersendiri menghadapi ramalan resesi global nIndonesia nArgentina nNeymar nJapan nDiogo Costa nBrazil nJepang njongdae FIFAWorldCup JinFesta ArigatoIndonesia ,Negatif
 Hah RESESI nLantas bagaimana dengan Indonesia Yuk simak informasi berikut ,Negatif
 Pelayaran Nasional Tetap Optimistis Hadapi Ancaman Resesi Global ,Positif
 maaf banget ini mah Indonesia bakal tetep kena resesi walaupun separah eropa Hal ini bisa terjadi karena masyarakat Indonesia itu konsumtif dan masih bisa ekspor produk pertanian ,Positif
 Semakin yakin Indonesia kebal resesi xbb ,Positif
 Bye Resesi nMenurut Sri Mulyani pertumbuhan yang tinggi ini menunjukkan pemulihan ekonomi Indonesia yang lebih baik dari negara lain nBahkan jauh lebih baik jika dibandingkan dengan beberapa negara maju nYang baik diaminkan ,Positif
 Kekuatan doa semoga bisa bangkitkan ekonomi Indonesia dan terhindar dari resesi nSetelah doa langsung pada belanja dan semangat kerja jangan cuma makan dan tidur saja ,Positif
 Benar setiap Kab Kota hrs siapkan lahan utk tanam Pangan Lokal non Beras Gandum shg Indonesia bisa kurangi impor Beras Gandum Gula Rafinasi Kedelai Jagung dll Syukur bisa swasembada bahkan bisa ekspor Resesi Global tdk mempan jika mandiri Pangan Lokal EBT Biofuel Biogas ,Positif
 Indonesia Masih Jauh Dari Resesi IKNMajukanSektorUMKM ,Positif
 Indonesia kemungkinan masih jaduh dari resesi IKNMajukanSektorUMKM ,Positif
 Ketika para Kadrun dan kroninya bilang ekonomi dunia hancur mereka belom liat ekonomi Indonesia lagi ada puncaknya Bukan berarti Indonesia lolos resesi tapi paling nggak ekonomi Indonesia membaik bahkan mulai meningkat ,Negatif
 PHK krn negara eropa banyak muali terdampak resesi Padahal mereka pengimpor barang diproduksi bbrp pabrik Indonesia Kalo masalah memutarbalikan fakta cebong kadrun sama saja emang hobinya Jadi usah merasa satu lebih baik dari lain ,Negatif
 Apa sampaikan itu benar banget Pemerintah Republik indonesia uda ngutang sampai lebih Tax amnesty kali juga Terima duit segitu banyak nya pertumbuhan ekonomi rakyat nasional loyo selama thn thn berjalan ini nyungsep Lalu sounding thn resesi ,Negatif
 gak usah terlalu bawa bawa ekonomi dunia Indonesia bukan pemain global terhindar dari ancaman resesi itu bukan prestasi membanggakan kalo org ekonomi pasti paham coba selama ini utangnya naik jor joran dampak ekonominya menurtmu sesuai gak ,Negatif
 Negara luar udah bahas resesi global dan cara mengatasinya negara indonesia masih bahas agama siapa paling benar ,Negatif
 sebentar lagi kan katanya resesi nih tapi banyak juga berpendapat bahwa kita Indonesia perlu khawatir soal resesi soalnya UMKM merupakan tulang punggung perekonomian Indonesia sehingga UMKM perlu terus dioptimalisasi oleh berbagai pihak BRIDukungG ,Negatif
 indonesia gak jadi resesi soalnya kpopers sibuk jualan DAN belanja,Negatif
 Tunjukin bukti kalo you semakin miskin jangan asal komentar melihat sesuatu jangan Dari satu sisi jadi orang harus bersyukur lihat negara lain pada resesi karena pandemi dan perang Ekonomi Indonesia masih bisa bertahan Ngga pernah bersyukur sih you ,Negatif
 Waah waah Putin ini kurang ajar sama saja menghina sistem pengamanan Indonesia apa Rusia tidak tau kekuatan pengamanan Indonesia sangat hebat sekalee dlm mengamankan negara sekarang pada resesi alias negara calon bangkrut berkumpul Bali nBuuahahahahahaha ,Negatif
 resesi Indonesia setelah dipikir sebenernya sikap Russia dan China hari ini windfall buat Indonesia bisa menyakinkan Eropa Barat gak ,Negatif
 Kalau dari berita ini sepertinya pernyataan tentang adanya resesi Indonesia perlu dicermati mendalam ,Negatif
 Klo rokok dilarang resesi bakal terjadi Indonesia ,Negatif
 Indonesia nih bos Mudah aman dari ancaman resesi global ,Negatif
GEROMBOLAN KADRUN LAKNAT YANG SUKA BUAT HOAKS HARUS DENGERIN NIH APAKAH RESESI INDONESIA KINI NGGA LAH YAOO ,Negatif
 penyesuaian harga BBM tak akan picu resesi indonesia itu pasti BBMSubsidi BBMBersubsidi BantuanBBMUntukRakyat BLTBBMTepatSasaran SubsidiTepatSasaran SemuaDemiKesejahteraan CerdasPakaiBBM BijakPakaiBBM Banten ,Negatif
 Anies ini memang biadab indonesia lagi berjuang terhindar dari resesi dia malah deklarasi bersama Nasdem sarang koruptor Sumatera Utara HTIDukungAnies AniesDidukungKHILAFAH AniesNasdemOut TenggelamkanAniesNasdem TenggelamkanPartaiNasdem GoodByeNasdemAnies ,Negatif
 Tak kiro muk nang Indonesia tok nInflasi kok ngamuk Krisis kok ngamuk nIku sih Aku durung faham nSenajan isih kudu iso syukur urip nang Indonesia janji sih iso nandur iso panen resesi Patek urus Sih iso mangan ,Negatif
 Tweetnya mas Yang video kebakaran itu ngasih gambaran kalau rakyat indonesia kemungkinan santuy sama resesi sama kayak video orang yang santuy padahal ada kebakaran besar ,Negatif
 Salah satu bukti kalow resesi tidak bakal mempan Indonesia ,Negatif
 indonesia tahan dari resesi soalnya ada jual wording ,Negatif
 Indonesia bisa bebas resesi yekan xad donasi doa aja gampang ,Negatif
 Indonesia mah miskiinn mau resesi pulak Makanya ngarep duit Arab Arab mah Negara tajiir makanya cebong kekii ,Negatif
 Gelaran Bali akan menjadi sejarah bagi Indonesia guna menciptakan perdamaian dunia mana kini dunia saat ini dalam ketidakpastian Ancaman resesi krisis pangan dan energi bahkan ancaman perang dunia ketiga menjadi nyata nJokowi Tokoh Perdamaian WorldPeace ,Negatif
 Inilah saatnya guwe membantu Indonesia menahan resesi dengan rabi adat jawa melayu ,Negatif
 Bentar lagi kita bisa nemu judul skripsi ttg pola konsumsi masyarakat Indonesia dalam pelaksanaan kegiatan berbasis adat dalam upaya ketahan terhadap ancaman resesi nBtw ini mereka duitnya darimana yaahh xad xad ,Negatif
 Setuju untuk memberantas koruptor Tidak setuju karena bakal banyak demo akan guncang ekonomi tidak cocok untuk saat ini krn dunia sdh resesi Indonesia sudah mati bertahan dan tidak jatuh terperosok ekonominya seperti negara lain wise aja brader ,Negatif
 Koyok ngene kok ngomonge resesi rakyat Indonesia sugih kabeh ,Negatif
 Indonesia gak jadi resesi ini mah ,Negatif
 sapa yang kemaren bacot indonesia resesi ,Negatif
 RUPIAH ANJLOK DANA ASING KABUR SEBERAPA KUAT SISTEM MONETER INDONESIA MELAWAN EKSPORT RESESI AMERIKA KEPADA DUNIA Khozinudin nSastrawan Politik tintamedia Islam Adalah Rahmat Istiqomah Dakwahkan Islam IslamMensejahterakanDunia ,Negatif
 Jgn kait mengkait Papua dgn Timor Leste boss Bilang saja kalau Papua merdeka ekonomi Indonesia resesi dan anda melarat sampah ,Negatif
 Resesi ekonomi khabarnya akan menimpa Indonesia Namun bukan khabar itu yang membuat cemas Yang bikin kita cemas adalah resesi demokrasi Sudah jatuh ketimpa tangga lagi Semoga kecemasan ini tidak akan menjadi kenyataan RakyatMonitor ,Negatif
 Resesi Serang Eropa dan Ekspor Sepatu Indonesia Loyo ,Negatif
 Kenapa orang Indonesia banyak yang bodoh nLogika aja kalo emang kepemimpinan Pakde bagus kok bisa saat negara lain resesi ancur ancuran Indonesia masih bisa makan nasi nKebebasan berpendapat masih bisa liat orang orang anti jokowi bikin video sana sini napas ,Negatif
 Tak Perlu Risau meski dibayangi Resesi pemerintah sangat yakin ekonomi Indonesia sangat cerah HargaBahanPokok BahanPokokStabil StockBahanPokok BBMTerkendali ,Negatif
 Indonesia katanya mau resesi iphone sold out dimana ,Negatif
 Nah gitu nOrg indonesia sekarang banyak bergaji besar nTinggal serukan saja jangan banyak jajan luar negri pake Commers tapi toko offline dan tradisional dalam negri nJadi perputaran uang dalam negri lancar apa itu resesi ,Negatif
 Airlangga Hartarto Indonesia Masih Bisa Keluar dari Resesi Tahun Depan ,Negatif
 Apa kata ekonom senior IMF Yan Carri Swallow tentang kemungkinan resesi ekonomi Indonesia MajalahTempo ,Negatif
 Inilah kenapa rakyat Indonesia bakal terkena resesi krn rakyat kita terlalu bergantung pada negara mau negara berperang ato apalah bagi kita penting makan ,Negatif
 Menaker Ida Fauziyah membeberkan tantangan ketenagakerjaan Indonesia tengah gejolak ekonomi dan potensi resesi global ,Negatif
 CORE Insight Badai PHK Menghantui Indonesia nBadai pemutusan hubungan kerja PHK mulai menyasar tenaga kerja tanah air Situasi bisa bertambah buruk mengingat ramalan banyak pihak mengenai ekonomi dunia pada akan jatuh jurang resesi ,Negatif
 Resesi Indonesia efeknya bakal kerasa kerasa amat kalau sektor konsumsi rumah tangga masih adem ayem ,Negatif
 Artinya dengan inflasi pertumbuhan nya minus besar nResesi besar sudah mengancam Turki nMasa bandingkan Indonesia dengan Turki xad xad nIndonesia skrg track menuju ekonomi terbesar dunia dalam tahun kedepan ,Negatif
 GDP naik yoy nIndonesia Anti Resesi nkadrun bangsat yang teriak perekonomian Indonesia susah kepalanya Nyungsep jurang kejebur kotoran onta nwkwkwkwkwk ,Negatif
 Kom Grab Indonesia Yang terakhir kami menyampaikan sedikit tantangan masa depan Sepertinya tidak asing bahwa kondisi perekonomian dunia sedang tidak stabil Ada inflasi risiko ancaman resesi bahkan untuk teknologi saat ini disebut dengan tech winter ,Negatif
 Indonesia kenal resesi Nyatanya ada sanggup beli tiket konser xbb ,Negatif
 Makanya baca berita ego dan dampak resesi itu cma Indonesia doang tapi banyak negara bego ,Negatif
 Ancaman resesi global dinilai berdampak juga Indonesia mulai dari ekspor hingga kaburnya dana asing ,Negatif
 Tengah Kepastian Indonesia Halau Resesi Cadangan Devisa Terendah Sejak April ,Negatif
 Apa itu resesi Tahun dunia kiamat juga orang Indonesia akan tetap santai aja ,Negatif
 Kenapa orang orang pada beli tempat minum yang harganya hampir masalah cuman buat apa xad makin ragu kalo pas resesi nanti Indonesia bakal ketar ketir yang gajinya aja masih bisa foya foya banyak gaya emang kita tuh diciptakan untuk survive ,Negatif
 Kata resesi telah menjadi perdebatan dalam beberapa waktu kebelakang Karena info yang mulanya diumumkan oleh Presiden Jokowi dan Menteri Sri Mulyani ini dianggap hanya menakut nakuti masyarakat Indonesia Padahal mereka diharapkan dapat bersiap diri menghadapi ancaman ini ,Negatif
 Ekonomi Indonesia mampu bertahan ditengah resesi dunia JokowiPresidenku PembangunanUntukRakyat PresidenJokowiHebat JokowiMembangunNegeri JokowiMajuBersamaIndonesia NKRIMajuBersamaJokowi nKalimantan Selatan ,Negatif
 Perekonomian global tahun depan diperkirakan mengalami krisis Sejumlah lembaga bahkan memperkirakan perekonomian global akan masuk jurang resesi pada tahun depan Namun Pemerintah Indonesia telah menyiapkan langkah untuk mengantisipasi hal tersebut ,Negatif
 tengah ancaman resesi global masyarakat masih rela antre untuk mendapatkan iPhone yang resmi dijual Indonesia pada Jumat ,Negatif
