Komentar,Sentimen
 Komitmen bank BRI yang terus menjaga sektor UMKM bisa mendorong pemulihan dan pertumbuhan perekonomian Indonesia dan meloloskan Indonesia dari jurang resesi TransformasiBRI ,Positif
 Resesi Ekonomi Pengertian Dampak dan Penyebabnya ,Positif
 Hadapi Resesi Global Ini yang Dilakukan Industri Telco Indonesia ,Positif
 Menteri Keuangan Menkeu Sri Mulyani optimistis perekonomian Indonesia bebas resesi Apalagi jika pertumbuhan ekonomi Indonesia tetap terjaga atas persen sampai penghujung tahun IndonesiaTanpaResesi EkonomiIndonesia ,Positif
 Kemaren ibox sumarecoon serpong katanya indonesia resesi iphone pro dan promax aja sold out Harus minggu nAlhasil gajadi deh beli males nunggu seminggu nPadahal uangnya udah ada rebu ,Positif
 Indonesia sdh mulai terdampak resesi dunia nGelombang PHK sdh mulai terjadi beberapa wilayah nSemoga Indonesia bisa melewati ancaman resesi ini salah satunya dengan memperkuat UMKM dan memperbanyak industri padat karya ,Negatif
 Negara Ini Bakal Resesi Indonesia Aman ,Positif
 Lebih overthinking mikirin indonesia bakal resesi dari pada mikirin kamu ,Positif
 HITC super rame ngantri makan ampe jam adalah bukti indonesia gabakal resesi ,Positif
 Resesi ada Pak Prabowo untuk rakyat Indonesia Mending Prabowo dekade ,Positif
 Dengan meningkatkan konsumsi dan daya beli masyarakat dalam negeri akan menyelamatkan Indonesia dari prediksi resesi global tahun Resesi IndonesiaTahanResesi IndonesiaHebat IndonesiaKuat ,Positif
 Kgmngkinan narasi nya nanti akan terbalik dijadikan alibi menyangkal kegagalannya disaat indonesia darurat ekonomi akibat hutang dan program serta kebijakan amburadul resesi global lah kambing hitamnya ,Positif
 Bank Rakyat Indonesia Persero Tbk tegaskan komitmen untuk terus mendorong pertumbuhan ekonomi tengah ancaman resesi global TransformasiBRI ,Positif
 Perhatian Serius UMKM mampu Selamatkan Indonesia dari Resesi Global JokowiPresidenku PembangunanUntukRakyat PresidenJokowiHebat JokowiMembangunNegeri JokowiMajuBersamaIndonesia JokowiBapakInfrastruktur ,Negatif
 kami hadir mendukung xef indonesia cegah resesi JokowiPresidenku PembangunanUntukRakyat PresidenJokowiHebat JokowiMembangunNegeri JokowiMajuBersamaIndonesia JokowiBapakInfrastruktur ,Negatif
 POKOKNYA AKU HARUS DAPET FOLLBACK xad nwalaupun aku belum pernah liat muka etmin uifess tapi aku yakin muka etminnya sangat bercahaya seperti lampu masjid untuk itu yakin etminnya bakal ngebebasin indonesia dari resesi tahun depan sih nyambung banget ,Negatif
 Masyarakat Jangan Khawatir Resesi Molen Indonesia Punya Sumber Daya Alam Berlimpah ,Negatif
 Dukung UMKM yang mampu selamatkan Indonesia dari resesi global JokowiPresidenku PembangunanUntukRakyat PresidenJokowiHebat JokowiMembangunNegeri JokowiMajuBersamaIndonesia JokowiBapakInfrastruktur ,Positif
 Pak Jokowi selamatkan Indonesia dari Resesi Global JokowiPresidenku PembangunanUntukRakyat PresidenJokowiHebat JokowiMembangunNegeri JokowiMajuBersamaIndonesia JokowiBapakInfrastruktur ,Negatif
 Ekonom Indonesia Masih Aman dari Ancaman Resesi Global lewat kinerjaJokowiBerhasil IndonesiaAmanResesiGlobal EkonomiKuat IndonesiaTahanResesi BbmAmanAPBNKuat EkonomiKuat SukseskanKebijakanPemerintah ,Positif
 Percayalah Indonesia Aman dari Ancaman Resesi Global Resesiglobal via IndonesiaAmanResesiGlobal EkonomiKuat IndonesiaTahanResesi BbmAmanAPBNKuat EkonomiKuat SukseskanKebijakanPemerintah ,Negatif
 Pengamat Indonesia Masih Aman dari Ancaman Resesi global lewat kinerjaJokowiBerhasil IndonesiaAmanResesiGlobal EkonomiKuat IndonesiaTahanResesi BbmAmanAPBNKuat EkonomiKuat SukseskanKebijakanPemerintah ,Positif
 Eks Wantimpres Indonesia Masih Aman dari Ancaman Resesi Global IndonesiaAmanResesiGlobal EkonomiKuat IndonesiaTahanResesi BbmAmanAPBNKuat EkonomiKuat SukseskanKebijakanPemerintah ,Positif
 Indonesia masih aman dari Ancaman Resesi Global IndonesiaAmanResesiGlobal EkonomiKuat IndonesiaTahanResesi BbmAmanAPBNKuat EkonomiKuat SukseskanKebijakanPemerintah ,Positif
 Punya pangsa pasar ekonomi yang besar Indonesia dinilai masih aman dari resesi global IndonesiaAmanResesiGlobal EkonomiKuat IndonesiaTahanResesi BbmAmanAPBNKuat EkonomiKuat SukseskanKebijakanPemerintah ,Positif
 Indonesia masih aman dari ancaman resesi global IndonesiaAmanResesiGlobal EkonomiKuat IndonesiaTahanResesi BbmAmanAPBNKuat EkonomiKuat SukseskanKebijakanPemerintah ,Positif
 Punya Pangsa Pasar Ekonomi yang Besar Indonesia Dinilai Masih Aman dari Ancaman Resesi Global IndonesiaAmanResesiGlobal EkonomiKuat IndonesiaTahanResesi BbmAmanAPBNKuat EkonomiKuat SukseskanKebijakanPemerintah ,Positif
 Pengamat sebut Indonesia masih aman dari ancaman resesi global IndonesiaAmanResesiGlobal EkonomiKuat IndonesiaTahanResesi BbmAmanAPBNKuat EkonomiKuat SukseskanKebijakanPemerintah ,Positif
 Namun UMKM sangat sensitif jika terkena krisis yang menyangkut kenaikan harga dan juga pembatasan mobilitas seperti yang terjadi selama PPKM COVID nHal ini juga mungkin terjadi masa resesi yang diprediksi oleh IMF akan terjadi pada tahun mendatang ,Negatif
 Tengah Ancaman Resesi Global Indonesia Jadi Magnet Investasi ,Positif
 UMKM akan selamatkan Indonesia dari resesi global JokowiPresidenku PembangunanUntukRakyat PresidenJokowiHebat JokowiMembangunNegeri JokowiMajuBersamaIndonesia JokowiBapakInfrastruktur ,Positif
 Tengah Ancaman Resesi Global Indonesia Masih Jadi Magnet Investasi ,Positif
 RESESI GLOBAL ikut menyongsong tahun politik Indonesia xae ,Positif
 INDONESIA TERBEBAS DARI RESESI EKONOMI xbc xef xbc xef nStay safe untuk wilayah Garut Jabar karna sekarang barusan Gempa xba xef xae ,Positif
 UMKM akan mampu selamatkan Indonesia dari Resesi Global JokowiPresidenku PembangunanUntukRakyat PresidenJokowiHebat JokowiMembangunNegeri JokowiMajuBersamaIndonesia JokowiBapakInfrastruktur ,Positif
 Pemerintah selamatkan Indonesia dari resesi global JokowiPresidenku PembangunanUntukRakyat PresidenJokowiHebat JokowiMembangunNegeri JokowiMajuBersamaIndonesia JokowiBapakInfrastruktur ,Positif
 Dengan perhatian serius dari pemerintah UMKM akan mampu selamatkan Indonesia dari resesi JokowiPresidenku PembangunanUntukRakyat PresidenJokowiHebat JokowiMembangunNegeri JokowiMajuBersamaIndonesia JokowiBapakInfrastruktur ,Positif
 Dengan Perhatian Serius daro Pemerintah Untuk UMKM akan Mampu Selamatkan Indonesia dari Resesi Global yang bisa terjadi JokowiPresidenku PembangunanUntukRakyat PresidenJokowiHebat JokowiMembangunNegeri JokowiMajuBersamaIndonesia JokowiBapakInfrastruktur ,Positif
 UMKM akan mampu selamatkan Indonesia dari resesi global JokowiPresidenku PembangunanUntukRakyat PresidenJokowiHebat JokowiMembangunNegeri JokowiMajuBersamaIndonesia JokowiBapakInfrastruktur ,Positif
 Media juga adakalanya suka ngarang Tergantung negara nya Kaya atau miskin nIndonesia kaya segala macem SDA bejibun Laut melimpah nJadi perlu takut Resesi Global Jokowi kerja ,Positif
 Semua presiden dunia pusing hadapi resesi taun depan cuma Indonesia yang Rakyatnya pusing ,Positif
 Dengan perhatian serius dari Pemerintah untuk UMKM akan mampu selamatkan Indonesia dari resesi Global JokowiPresidenku PembangunanUntukRakyat PresidenJokowiHebat JokowiMembangunNegeri JokowiMajuBersamaIndonesia JokowiBapakInfrastruktur ,Positif
 UMKM mampu menyelamatkan Indonesia dari resesi global JokowiPresidenku PembangunanUntukRakyat PresidenJokowiHebat JokowiMembangunNegeri JokowiMajuBersamaIndonesia JokowiBapakInfrastruktur ,Positif
 Keren Semoga menjadi lahan pekerjaan dan pemerataan ekonomi Indonesia Kalau adapun resesi kita bisa selamat seperti terjadi sekarang ini Hanya pemimpin berani mengambil keputusan tidak populer namun punya visi kedepan akan menyelamatkan bangsa ini ,Positif
 Perhatian serius terhadap UMKM mampu selamatkan Indonesia dari resesi global JokowiPresidenku PembangunanUntukRakyat PresidenJokowiHebat JokowiMembangunNegeri JokowiMajuBersamaIndonesia JokowiBapakInfrastruktur ,Positif
 indonesia gak bakal resesi itu toko mas masih penuh ama ibu ,Negatif
 UMKM akan mnjadi penyelamat Indonesia dari resesi global JokowiPresidenku PembangunanUntukRakyat PresidenJokowiHebat JokowiMembangunNegeri JokowiMajuBersamaIndonesia JokowiBapakInfrastruktur ,Positif
 Yakin UMKM mampu selamatkan Indonesia dari resesi global JokowiPresidenku PembangunanUntukRakyat PresidenJokowiHebat JokowiMembangunNegeri JokowiMajuBersamaIndonesia JokowiBapakInfrastruktur ,Positif
 Pemerintah dorong UMKM untuk selamatkan Indonesia dari resesi global JokowiPresidenku PembangunanUntukRakyat PresidenJokowiHebat JokowiMembangunNegeri JokowiMajuBersamaIndonesia JokowiBapakInfrastruktur ,Positif
 Mantap UMKM akan Mampu selamatkan Indonesia Dari Resesi Global yang Terjadi JokowiPresidenku PembangunanUntukRakyat PresidenJokowiHebat JokowiMembangunNegeri JokowiMajuBersamaIndonesia JokowiBapakInfrastruktur ,Positif
 Dengan TransformasiBRI berkelanjutan maka Bank Rakyat Indonesia Persero Tbk menyatakan komitmennya untuk terus mendorong pertumbuhan ekonomi domestik tengah ancaman resesi global saat ini TransformasiBRI ,Positif
 tengah isu resesi global UMKM mampu menyelamatkan Indonesia JokowiPresidenku PembangunanUntukRakyat PresidenJokowiHebat JokowiMembangunNegeri JokowiMajuBersamaIndonesia JokowiBapakInfrastruktur ,Positif
 Akan Mampu Selamatkan Indonesia Dari Resesi Global yang Bisa Terjadi JokowiPresidenku PembangunanUntukRakyat PresidenJokowiHebat JokowiMembangunNegeri JokowiMajuBersamaIndonesia JokowiBapakInfrastruktur ,Positif
 UMKM mampu selamatkan Indonesia dari resesi global JokowiPresidenku PembangunanUntukRakyat PresidenJokowiHebat JokowiMembangunNegeri JokowiMajuBersamaIndonesia JokowiBapakInfrastruktur ,Positif
 pemerintah positif indonesia selamat dari resesi JokowiPresidenku PembangunanUntukRakyat PresidenJokowiHebat JokowiMembangunNegeri JokowiMajuBersamaIndonesia JokowiBapakInfrastruktur ,Positif
 perhatian serius pemerintah mampu selmatkan indonesia dari resesi JokowiPresidenku PembangunanUntukRakyat PresidenJokowiHebat JokowiMembangunNegeri JokowiMajuBersamaIndonesia JokowiBapakInfrastruktur ,Positif
 UMKM mampu selamatkan Indonesia dari resesi global yang bisa terjadi JokowiPresidenku PembangunanUntukRakyat PresidenJokowiHebat JokowiMembangunNegeri JokowiMajuBersamaIndonesia JokowiBapakInfrastruktur ,Positif
 PEMERINTAH AKAN MAMPU SELAMATKAN INDONESIA DARI RESESI GLOBAL YANG BISA TERJADI JokowiPresidenku PembangunanUntukRakyat PresidenJokowiHebat JokowiMembangunNegeri JokowiMajuBersamaIndonesia JokowiBapakInfrastruktur ,Positif
 Dengan perhatian serius dari pemerintah untuk UMKM akan mampu selamatkan Indonesia dari resesi global yang bisa terjadi JokowiPresidenku PembangunanUntukRakyat PresidenJokowiHebat JokowiMembangunNegeri JokowiMajuBersamaIndonesia JokowiBapakInfrastruktur ,Negatif
 Iya pastilah karena mereka masih memiliki otak yang bekerja Indonesia masih orisinal tak dipakai berpikir apalagi pusing memikirkan nasib rakyat ambang resesi dunia ,Positif
 Gubernur Jawa Barat memuji kinerja Menteri Koordinator Bidang Perekonomian Menurut Gubernur Jabar Airlangga berhasil meloloskan Indonesia dari ancaman resesi ekonomi rekan Juara ,Negatif
 Pak Jokowi selamatkan Indonesia dari resesi global JokowiPresidenku PembangunanUntukRakyat PresidenJokowiHebat JokowiMembangunNegeri JokowiMajuBersamaIndonesia JokowiBapakInfrastruktur ,Positif
 Peran Kadin sangat dibutuhkan untuk bersama sama mengurangi dampak resesi global yang akan melanda Indonesia beberapa bulan kedepan ARSRapimnasKadin nIndonesia Maju nIndonesia Emas ,Positif
 Semua Kepala Negara Dunia Pusing Hadapi Resesi Global Jokowi Indonesia Tidak ,Positif
 Presiden Jokowi Negara besar resesi tapi ekonomi Indonesia tumbuh Jokowi Indonesia ,Positif
 Asbun disini bilang Indonesia sdh hebat sdh maju dilain tempat bilang kita sdh susah ekonomi terancam resesi pendapatan negara minim blablabla ,Positif
 Dengan menjaga kestabilan daya beli masyarakat maka Indonesia akan tahan terhadap resesi ekonomi global yang diprediksi akan datang pada tahun ResesiEkonomi IndonesiaKuat IndonesiaHebat ,Positif
 Tahun depan tahun ini akan jauh lebih sulit lagi untuk semua negara dan diperkirakan awal tahun depan sudah masuk pada resesi global kata Jokowi DiorGlobalAmbassadorSEHUN resesiglobal ekonomiglobal ,Positif
 Banyak negara besar yang bersiap resesi namun Indonesia aman dari resesi karena strategi yang baik dengan pertumbuhan ekonomi Jokowi Indonesia ,Positif
 Indonesia menjadi titik terang bagi ekonomi dunia dengan pertumbuhan ekonomi Indonesia berhasil capai tengah ancaman resesi global indonesiamendunia MenujuIndonesiaMaju Ekonomi ,Positif
 RESESI SEMAKIN DEKAT PRESIDEN JOKOWI SRI MULYANI SERTA MAHFUD DAN AIRLANGGA UNTUK NEGERI Resesi Resesi Global Semakin Dekat ,Positif
 Menghadapi resesi global diperlukan semangat gotong royong Kita sudah teruji dalam menavigasi krisis dan resesi ,Positif
 Perhatian serius pemerintah UMKM disebut bisa selamatkan Indonesia xae dari resesi StrategiHadapiKrisis StrategiHadapiKrisis ,Positif
 Dampak dari Covid yang berkepanjangan ditambah dengan perang Rusia Ukraina membuat ekonomi dunia masuk dalam masa resesi Tahun Presiden menteri keuangan dll mengatakan bahwa tahun akan lebih gelap lagi Kira kira Indonesia bisa aman dari resesi ,Positif
 Pertumbuhan ekonomi jadi bekal pemerintah untuk atasi resesi global StrategiHadapiKrisis ,Positif
 Menurut gua sih Prince ini emang tipe yang ambisius banget dilihat dari gerak bibirnya dia mau menyampaikan permasalahan resesi nanti yang katanya akan menjadi teror bagi masyarakat dunia khususnya Indonesia ,Positif
 Melihat dan nyimak retweetnya yakin taon depan indonesia inshaaAllah gak akan resesi nHarum man ,Positif
 Maruf Amin sebut Tanah Papua majemuk dan daerah paling toleran StrategiHadapiKrisis Indonesia Anti Resesi ,Positif
 Tumbuhnya ekonomi Indonesia bisa menjadi Bekal untuk menghadapi Resesi Global StrategiHadapiKrisis IndonesiaAntiResesi ,Positif
 Pertumbuhan ekonomi Republik Indonesia tumbuh jadi bekal pemerintah untuk atasi resesi global StrategiHadapiKrisis MariBerinvestadidiIndonesia ,Positif
 StrategiHadapiKrisis perhatikan serius pemerintah UMKM nDisebut bisa selamatkan Indonesia dari resesi StrategiHadapiKrisis ,Positif
 Anda fikir rakyat Indonesia hanya reuni doang nGmna sih cara pikirnya reuni kok dijadikan acuan terjadi resesi atau tidaknya ,Positif
 Seperti tulisan saya harian ini probabilitas resesi Indonesia relatif kecil Memang pertumbuhan ekonomi Indonesia akan melambat tapi bukan resesi ,Positif
 Waalaykumsalam lek nMau resesi inflasi tim jagoan pildun pulang duluan harus tetap take easy man seperti yang dicontohkan Content Creator Indonesia lek ,Positif
 Headline nya mancing nih Padahal kan harusnya kita semua tau kalau indonesia itu ekonominya bakal kecipratan resesi dunia karena umkm kita kuat Makanya harus terus belanja ,Negatif
 Waspada Resesi Ini Tips Kelola Portofolio Investasi ,Positif
 Isu resesi indonesia itu jokes doang iyalah coba aja liat ticket konser harga jutaan masih bisa abis dlm beberapa menit bahkan detik dimana resesinya ,Positif
 tadi pagi baru ngomong Indonesia negara paling aman saat dunia resesi nsekarang berkata begini ningin periode kayaknya ,Positif
 klau aku sbg pak pasti nggak mau pusing amatlah koq ada rkyt ngomongnya skrg makin sulit makin susah bisa nya buat acara reunian nggak dilakukan dikala resesi berarti klau masih ada reunian indonesia baik ,Positif
 Syukurlah kalau begitu kita terus mendoakan Indonesia agar tidak resesi baik baik saja Amin ,Positif
 Kepala negara yang pusing karena memikirkan bagaimana bisa bertahan dari resesi dll Paham kan kenapa Indonesia gak pusing ,Positif
 Siapkah Anda menghadapi resesi ekonomi xbb vccfootballofc vccfootballcryptobet vccfootballworldcup vccfootballqatar cuan Indonesia Olahraga Bola investment penghasilantambahan ,Positif
 UMKM disebut bisa selamatkan Indonesia dari Resesi mendapat perhatian Serius dari Pemerintah umkm indonesia ,Positif
 Beberapa negara sudah alami resesi Akankah Indonesia mampu bertahan ,Positif
 Indonesia tak kenal resesi ,Positif
 Presiden Jokowi Indonesia Harus Optimistis Hadapi Resesi TempoVideo ,Positif
 Resesi mungkin akan jadi nyata untuk Indonesia salah satu cara mengatasi krisis pangan melalui ide dari Olly Dondokambey yaitu berkebun ,Positif
 Diramal Resesi Jokowi Indonesia Harus Optimis ,Positif
 rasa otak loe harus banyak cuci biar sedikit cerdas nKenapa Indonesia tidak akan kena resesi nKrn presiden nya pak Jkw nJELAS kerjanya rakyat hasilnya negeri ini terbebas dari krisis krn resesi nKalau presiden nya loe nMengelola otak loe aja ngga sanggup ,Positif
 Komitmen bank BRI yang terus menjaga sektor UMKM bisa mendorong pemulihan dan pertumbuhan perekonomian Indonesia dan meloloskan Indonesia dari jurang resesi KinerjaBRIQ ,Positif
 Jadi semuanya dapat dengan keuntungan sektor UMKM berdaya dan aman juga perekonomian Indonesia meningkat sehingga dapat menghalau ramalan resesi yang menghantui KinerjaBRIQ ,Positif
 Indonesia tidak terdampak resesi dengan penyesuaian harga BBM ,Positif
 ASEAN Siap siap Sri Mulyani Sebut Ada yang Berpotensi Resesi ,Positif
 Masih Ada Harapan Kok untuk Selamat dari Resesi CNN Indonesia Opsiin OmKamidi ,Negatif 
 Awan hitam menyelimuti Indonesia benarkah tahun resesi seperti yang dikatan rezim saat ini wdyt ,Positif
 Sektor UMKM merupakan pelindung bisa menghadapi tekanan ataupun resesi ekonomi FYI serapan tenaga kerja Indonesia berada pada UMKM khususny sektor mikro KinerjaBRIQ ,Negatif 
 Jokowi Salah Satu Fokus APBN Adalah untuk Membangun IKN Nusantara jokowi ikn nusantara apbn fokus anggaran resesi ekonomi indonesia nasional prmn pikiranrakyat prmnsahabatumkm pikiranrakyatmedianetwork potensilokalgonasional ,Positif
 Resesi ada Pak Prabowo untuk rakyat Indonesia dekade MendingPrabowo Pilpres terusmajubersamaprabowo ,Negatif
 Anggaran Ketahanan Pangan APBN Sangat Kecil Pengamat Sebut Masa Resesi Bakal Banyak yang Kelaparan Indonesia ,Positif
 Kenaikan harga bbm bisa selamatkan ekonomi Indonesia dari ancaman resesi global ,Positif
 Ekonomi Indonesia saat ini yang mengalami resesi pun mampu diatasi dengan baik oleh beliau arsjadrasjid ,Negatif
 Gelaran Expo Star Smeshub Siap Menjadi Solusi UMKM Menghadapi Resesi umkm Desember JumatBerkah ,Positif
 Indonesia tidak masuk Zona Resesi sandiagauno sandiuno Kemenparekraf Twitter Trending FYP BreakingNews Jumat JumatBerkah JumaMubarak Desember SpotifyWrapped Mandiri Still Life indonesiamendunia Resesi ,Positif
 Lancarnya pasokan logistik dalam negeri diakibatkan pembangunan infrastruktur yang masif mampu membentengi perekenomian indonesia dari inflasi tinggi dan meredam kekacauan pasar karena lalu lintas dagang lancar Indonesia relatif kuat resesi dibanding negara lain ,Negatif
 iya betul kepala negara indonesia tidak pusing tengah dunia landa resesi rakyatnya aja yang musing mikir presiden yang mecla mecle ,Positif
 resesi Indonesia jadi dhuafa segunung hutang ,Positif
 semoga indonesia tidak terdampak resesi global ,Positif
 Ini Penyebab Ekonomi Indonesia Tetap Kuat Meski Badai Resesi Makin Besar ,Negatif
 Masih Ada Harapan Kok untuk Selamat dari Resesi ,Positif
 Resesi dunia tak perlu ditakuti Namun tetap perlu diwaspadai Perlu kesatuan industri yang kuat terutama sektor tekstil dan produk tekstil untuk menjaga Indonesia sandang tetap maju Vice CEO Pan Brothers Tbk Anne Patricia Sutanto Kompas CEO Forum ,Negatif
 Eropa itu kena resesi inflasi tinggi nJd mangkin menggila aja tingkah orang nya Salah satu trdampak krn kesongong mereka sndiri kasih sanksi rusia malah mental semua nBrsyukur Indonesia pny pak Jokowi nKita trlalu kena dampak ,Positif
 Perhatian serius pemerintah UMKM disebut bisa selamatkan Indonesia dari Resesi ,Positif
 Gelar Expo Star Smeshub Siap Jadi Solusi UMKM Hadapi Resesi nSelengkapnya ,Positif
 Dampak Resesi Global Terhadap Industri Properti Indonesia ,Positif
 Semangaat INDONESIA nPerkembangan nDinamika Global nSEMOGA Pertumbuhan Ekonomi Thn lebih Thn nJika pertumbuhan ekonomi positif artinya tidak ada resesi Meningkatkan pengendalian inflasi nThn smg inflasi bawah ,Positif
 Menghadapi tantangan resesi ditahun nlogam nikel bangsa indonesia nDiresmikan menjadi mata uang kepemerintahan Uni nusantara nYang disetarakan dengan pajak perdagangan ekspor nSehingga uang logam nikel mampu disetarakan dengan nilai mata uang rupiah terhadap negara ,Positif
 Presiden Joko Widodo Jokowi meminta gubernur bupati wali kota untuk memperhatikan pergerakan inflasi setiap saat koranjakarta jokowidodo ekonomi domestik global resesi inflasi fiskal moneter krisis infoterkini indonesia news update ,Positif
 Lalu bagaimana peran pemerintah untuk bisa menjaga stabilitas ekonominya dalam menghadapi resesi yang mana hal tersebut menjadi tantangan tersendiri bagi Indonesia ,Positif
 Indonesia pada tahun dipastikan akan menghadapi ancaman resesi global yang ndiakibatkan meningkatnya harga komoditas pangan dan energi sebagai dampak perang nRusia Ukraina dan pasca pandemi Covid ,Positif
 Subsidi BBM begitu besar akan memberatkan budget pemerintah bahkan tingkat tertentu akan menyulitkan pemerintah nEks Ketua Dewan Komisioner OJK Muliaman Darmansyah Hadad menilai bhwa kenaikan harga BBM sbg langkah menyelamatkan Indonesia dari ancaman resesi ,Positif
 tahun resesi versinya rezim rakyat akan lihat sejatinya rezim ini apakah mereka berbohong atau delusi sementara jutaan orang sudah korban phk karena kekhawatiran tahun resesi ada banyak rakyat lapar pak semoga langit hitam tidak menyelimuti indonesia ,Positif
 Amerika Resesi Awal Wall Street Bakal Anjlok ,Positif
 Tidak masuk akal Indonesia ini terdampak resesi xae xae xae buktinya Uang Tambang Ilegal saja bisa Milyaran perbulan tapi hanya goreng kelompok Indonesia ini adalah Negara Adikuasa Kalau saja otak menjalankan Roda Negara ini cerdas maka Rakyat pasti Bahagia ,Negatif
 Perhatian Serius Pemerintah UMKM Bisa Selamatkan Indonesia dari Resesi IKNBawaNKRIBangkit IKNuntukPemerataanEkonomi ,Negatif
 Perhatian Serius Pemerintah UMKM Bisa Selamatkan Indonesia dari Resesi airlangga doring standardisasi produk UMKm IKNBawaNKRIBangkit IKNuntukPemerataanEkonomi ,Negatif
 Kayaknya indonesia beneran resesi dah ,Positif
 Badai Resesi Hantam Ekonomi Global Bagaimana Nasib Indonesia ,Negatif
 Potensi Indonesia menjadi negara pensuplay npangan sangat terbuka lebar asalkan pemerintah serius serta didukung dengan kebijakan makro dan mikro kita yakin peluang ini akan mampu mempercepat laju peertumbuhan ekonomi nasional kita lanyalla krisis resesi ,Positif
 Kondisi ini selain ancaman merupakan tantangan untuk Indonesia Terkait dgn tantangan LNM menyampaikan bahwa Indonesia harus membentuk kekuatan berbagai komoditas pangan bisa masuk Amerika dan Erofa tingginya pangan merupakan npeluang Indonesia lanyalla krisis resesi ,Positif
 resesi Indonesia ,Negatif
 Lucu startup kita katanya banyak ambruk dan takut resesi faktanya startup luar berdatangan indonesia menggantikan bertumbangan itu ,Negatif
 faktor pesimis kalo orang indonesia terutama berduit melakukan aksi tahan duit karena kemakan issue horor resesi padahal horor itu justru akan terjadi bila tidaka ada perputaran ekonomi akibat nahan duut ,Negatif
 Tahun diprediksi menjadi tahun resesi global Hilirisasi dengan dukungan investasi dalam negeri menjadi kunci agar Indonesia bisa bertahan saat resesi ,Positif
 Erma Optimistis Penguatan UMKM Bisa Selamatkan Ekonomi dari Resesi ASKARA Penguatan dan Pemberdayaan Usaha Mikro Kecil dan Menengah UMKM bisa menyelamatkan perekonomian Indonesia dari kekhawatiran terhadap terpaan resesi ekonomi tahun nDemikian ,Positif
 WOW nBanyak nKecil dah Pintar CARI DUIT nARTINYA nINDONESIA AMAN nDARI RESESI DUNIA nINDONESIA KYK INGGRIS nYG KELAPARAN nMAKA JARANG KASUS BUNUH DIRI nINDONESIA KEREENN nBISA DIKAU nBIKIN PERTANYAAN nHAH HAH HAH ,Negatif
 gpp Packk Pak Anies calon SekJen PBB Toh juga ntar Indonesia resesi Allah ingin menyelamatkan Pak Anies ,Positif
 Menghadapi kondisi ekonomi yang sulit tengan isu resesi yang dipredisikan akan terjadi Kantor Perwakilan Bank Indonesia Provinsi Jawa Tengah optimis perekonomian Jawa Tengah tetap tumbuh tinggi sekitar yoy ,Positif
 Peluang Investasi Tetap Terbuka Tengah Tantangan Resesi ,Negatif
 Dear RisingWoman nTernyata bukan Resesi Ini Biang Kerok Ambruknya Ekonomi Global pada ,Negatif
 Ekspansi masih terus dilakukna oleh Segar Kumala Indonesia Tbk BUAH meski saat ini berada tengah situasi inflasi tinggi yang menggerus daya beli masyarakat Indonesia serta adanya ancaman resesi ekonomi global nSelengkapnya ,Negatif
 Siap memantau keadaan Pasti Indonesia aman dari ekonomi global yang terancam resesi ,Positif
 Resesi global bukan hal yang menakutkan bagi Indonesia IndonesiaTanpaResesi EkonomiIndonesia ,Negatif
 Indonesia siap hadapi resesi IndonesiaTanpaResesi EkonomiIndonesia ,Negatif
 Ekonomi Sulsel Tak akan Dipengaruhi Bayang bayang Resesi nBaca Selengkapnya media Online news BreakingNews Ekonomi sulsel bayangbayang resesi Indonesia ,Positif
 tengah ketidakpastian ekonomi dan ancaman resesi global bagaimana nasib sektor konstruksi Indonesia ,Positif
 Indonesia harus punya rencana untuk hadapai resesi global ,Positif
 Resesi global bukan hal yang menakutkan bagi Indonesia ,Positif
 Kita Harus Hadapi Ancaman Resesi Global Karena Bukan Hal Yang Menakutkan Bagi Indonesia ,Positif
 Ancaman resesi global bukan hal menakutkan bagi Indonesia dan harus kita hadapi ,Positif
 BPS menilai inddikator makroekonomi Indonesia cenderung membaik dan sangat jauh dari ancaman resesi ,Positif
 Terpopuler Potensi ancaman resesi ekonomi global jadi atensi para operator seluler Indonesia Mereka masing masing menyiapkan jurus tangkisan ,Positif
 Semoga APBN Kita tetap terjaga menopang ekonomi Indonesia sehingga tidak terdampak ancaman resesi global ,Positif
 Bank Indonesia Kencangkan Sabuk Pengaman Hadapi Ancaman Resesi Tahun ,Positif
