Komentar,Sentimen
 Masih bingung sama namanya Indonesia punya utang triliyunan kenapa nyuruh peruri aja cetak uang yang banyak tukar sama dollar terus bayarin utang itu jadi ada namanya resesi kenapa semua negara matoknya harus sama dollar sih ,Negatif
 Perang Ukraina Rusia jadi ancaman resesi dunia Indonesia lakukan pengendalian inflasi ,Negatif
 Indonesia bakalan resesi ,Negatif
 Ini berita hoax Berita palsu nRedaksi harus bertanggung jawab nTau kah kalian negeri ini sedang hancur mengalami kemunduran ekonomi sulit hutang meroket penguasanya oligarki rakyatnya sengsara menderita resesi ambruk bubar nIni berita hoax mungkin ini Indonesia ,Negatif
 Harga minyak dunia naik saat ini krn ancaman resesi dunia akibat perang rusia ukraina nHarga BBM Indonesia gak naik nKadrun kok diem aja ngasih apresiasi atau gimana kek ,Negatif
 Aku kena bgt imbas covid tergantung masing bisa survive apa enggk bagus melihat indonesia luas jml penduduk bnyk bgt sampe resesi krisis ekonomi Nyatanya org msh bnyk bisa bertahan mskipun mudah ,Negatif
 Menteri Pertahanan Prabowo Subianto ingatkan Indonesia untuk waspada menghadapi krisis global Prabowo Subianto mengingatkan semua pihak untuk mengantisipasi kemungkinan resesi mengingat sejumlah negara menilai bahwa tahun depan akan menjadi tahun berat ,Negatif
 Salah satu sektor yang terdampak ancaman resesi dan kenaikan suku bunga Bank Indonesia adalah sektor properti Lantas bagaimana perhitungan ideal untuk mengambil KPR dalam situasi ini Simak selengkapnya dalam infografis berikut focus kpr infog ,Negatif
 salahsatu hal meyakinkan gadanya RESESI INDONESIA ,Negatif
 Sepertinya Jokowi bakal tumbang saat ombak resesi ekonomi menghantam Indonesia ,Negatif
 DPR Nilai Indonesia bakal Parah Terdampak Resesi Ekonomi Jika Tak Antisipasi ,Negatif
 Karena beberapa faktor ekonomi banyak negara yang gagal bayar utang selain itu diingatkan Indonesia untuk tetap waspada tengah ancaman resesi ResesiEkonomi Seokjin Blackpink Rihanna Tahun BankMandiri ,Negatif
 Indonesia sudah beberapa kali mengalahkan kondisi resesi ekonomi Namun apakah tahun depan yang digadang akan terjadi resesi lagi Indonesia sudah siap menghadapi resesi resesi resesiekonomi waspadaresesi ReferensiTeruji infografis Validnews ,Negatif
 Anggota DPR Indonesia Terdampak Parah Resesi Ekonomi Dunia Jika Pemerintah Tidak Antisipasi ,Negatif
 Pernyataan Sikap Gabungan Serikat Buruh Indonesia GSBI Nomor DPP GSBI JKT nMenentang Gelombang PHK dan Menuntut Kenaikan Upah Buruh Tengah Resesi Stagfasi Global ,Negatif
 Tiktok indonesia tahun depan resesi nIbox beli iphone kudu antri karena yang mau beli kebanyakan ,Negatif
 Pemuter roda perekonomian Indonesia agar resesi tahun depan ,Negatif
 Indonesia apa itu resesi ,Negatif
 Iya artinya lagi mikir Indonesia resesi ,Negatif
 Kok kerja pemerintahan Jokowi Amin dianggap sia sia oleh BEM nIndonesia tidak resesi kalian masih kuliah dengan tenang apakah itu pekerjaan sia sia pemerintah nMahasiswa atau mahasewa sih ,Negatif
 kan resesi cuma buat orang menengah kebawa wicis pddk indonesia Mall itu bukan realita kak Antri kaya gitu biasa kali Kalo mau liat ekonomi nasional liat antri sembako sama loker mekdi ,Negatif
 gajadi resesi kayaknya nih ,Negatif
 Indonesia resesi Blackpink World Tour Jakarta Concert cplis ada bantu war ticket nBegitu ada Kpop Concert lsg lupa resesi Burn money burn nBlackpink Pemersatu Indonesia ,Negatif
 ribuan relawan akan berkumpul Tugu Proklamasi utk memperingati Hari Sumpah Pemuda akan diisi dgn doa bersama utk bangsa Indonesia agar bangsa ini lepas ancaman krisis global spt resesi ekonomi sdh dialami negara lain Dukung Total Ganjar Pranowo SumpahRelawan ,Negatif
 Indonesia dibawah Jokowi KURANG GAUL ndalam Perdagangan Dunia nJadi kalau terjadi RESESI GLOBAL maka nEFEK melemahnya EXPORT akan MINIMAL ndibanding besarnya GDP Indonesia nTapi INGAT ketika ada KRISIS PERUMAHAN ndi IHSG drop dlm SETAHUN ,Negatif
 Jika Tidak Antisipasi Indonesia Terdampak Parah Resesi Ekonomi ,Negatif
 Negara konsumtif kek indonesia yang kemungkinan bakalan mencegah terjadinya resesi ,Negatif
 Soroti Antrian Membludak Saat Pre Order iPhone Series Indonesia Netizen Apa Itu Resesi ,Negatif
 Resesi minder masuk Indonesia ,Negatif
 naahh pemuda pemudi indonesia bersatu melawan resesi eaa xae xae xae ,Negatif
 nDibawah Jokowi Indonesia KURANG GAUL ndalam Perdagangan Dunia nJadi kalau terjadi RESESI GLOBAL maka nEFEK melemahnya EXPORT akan MINIMAL ndibanding besarnya GDP Indonesia nTapi INGAT ketika ada KRISIS PERUMAHAN ndi IHSG drop dlm SETAHUN ,Negatif
 indonesia itu memang outlier npola konsumtif masyarakatnya udah terbukti menyelamatkan negara ini dari berbagai ancaman resesi ncmiiw ,Negatif
 Ini yang buat Indonesia lebih kuat sama resesi perilaku konsumtif Jadi uang mutar terus wkwkwk ,Negatif
 Siaga Badai PHK Badai Resesi Mulai Terasa CNBC Indonesia ,Negatif
 Resesi Indonesia ,Negatif
 Gak paham apa yak dunia mulai terancam resesi sejak adanya coved belajar lagi bkn hny indonesia drop goblok ,Negatif
 cukup orang Indonesia ngerasain efek resesi agar retailer barang high end tetep hidup Cuman emang influencer fear mongering nakut ngeselin ,Negatif
 Resesi Apa itu nCelana dalam berlampu dengan fitur GPS saja masih bisa laku Indonesia ini Hanya pesan sekarang ,Negatif
 Valid berarti kata beberapa Ekonom Indonesia terdampak resesi lol ,Negatif
 Gimana mau foya foya ada duit Tapi ini salah satu cara untuk menekan resesi emang harus banyak belanja Suruh orang kaya pada belanja pak supaya menekan resesi Untung indonesia perilaku konsumtifnya tinggi ,Negatif
 Resesi tuh perlu ditakutin daya beli orang Indonesia kuat perlu khawatirin tuh kalo udah masuk inflasi beda cerita ,Negatif
 resesi itu hanya mitos bagi orang Indonesia ,Negatif
 Kalo pemerintah tidak hati hati Bagaimana pun akan terjadi nBahkan udah diramal bahwa Indonesia bisa resesi ,Negatif
 dikata resesi indonesia doang apa ,Negatif
 Resesi ini yang kena global negara negara yang ngandelin impor ekspor Sama kayak Indonesia perusahaan yang kena yang ngandelin ekspor impo atau perusahaan start yang ngincer valuasi bukan keuntungan ,Negatif
 Dampak Resesi Global terhadap Ekonomi Indonesia Ini Kata Mantan Menkeu ,Negatif
 isu resesi cuma akal aja kali wkwk biar ada yang ngerasa jadi Satrio Piningit indonesia ,Negatif
 para pemberi kerja skrg punya tim untuk melihat background diluar pendidikan termasuk aktifitas sosial medianya cuma Indonesia palagi skrg jaman resesi dunia manapun pengurangan pekerja terjadi msh kerja gunakan sebaik baiknya ,Negatif
 Semoga Indonesia tetap bertahan dalam menghadapi resesi kedepan Amin Allah resesi Indonesia EkonomiRIMenguat nikitamirzani ,Negatif
 Saat ini berbagai negara menghadapi ancaman resesi global ekonomi termasuk Indonesia Dibayangi hantu resesi global kemarin harga nikel masih bertengger angka cukup tinggi nklik link dibawah ini lme ,Negatif
 Financial planner niche fearmongering resesi kehancuran indonesia dunia gelap pada iPhone gak nih nMasa kalah ama ditakut ,Negatif
 Nah dengerin nih saran dari Sri Mulyani Ekonomi Indonesia resesi Inflasi ,Negatif
 Resesi Mengancam Fraksi GIB Gula APBD Jember Jangan Jadi Pil Pahit nJember Fraksi Gerakan Indonesia Berkarya GIB DPRD Kabupaten Jember Jawa Timur PolitikPemerintahan APBDJember DPRDJember via ,Negatif
 Indonesia Pasti Terdampak Jika Global Alami Resesi koranjakarta ekonomi resesi bisnis inflasi sosial tiongkok korea singapura amerikaserikat vietnam taiwan unieropa infoterkini indonesia news update ,Negatif
 Jika Resesi Ekonomi Global Tak Diantisipasi Indonesia Bisa Terdampak Parah ,Negatif
 point terakhir bikin indonesia resesi ,Negatif
 Ekonom Indonesia Wajib Pertahankan Momentum Pemulihan Ekonomi agar Terhindar dari Resesi ,Negatif
 Tahun depan ekonomi dunia diprediksi akan gelap Oleh karena itu kalian para pemuda dan pemudi Indonesia diharapkan menjadi pelita yang menerangi Indonesia dari gelapnya ancaman resesi global nMaju terus generasi muda Indonesia xae ,Negatif
 Resesi Mengancam Bos Unilever Indonesia Bicara Soal Peluang dan Pertumbuhan Bisnis Tahun ,Negatif
 Bank Hana Buka bukaan Soal Dampak Ancaman Resesi Global Indonesia Aman TrenAsia ,Negatif
 Ancaman Resesi Kian Nyata Bagaimana Nasib Lapangan Kerja Indonesia Opsiin ,Negatif
 resesi ekonomi yang sangat besar Akankah ekonomi Indonesia juga ikut terseret jurang resesi resesiekonomi ekonomiindonesia PovCorn LPIIFEBUNRI ,Negatif
 Badai resesi ekonomi kerap dikenang sebagai mimpi buruk seluruh negara dunia Indonesia apalagi Pengaruh resesi ekonomi cukup besar Nusantara Bahkan mampu meruntuhkan dua rezim pemerintahan ,Negatif
 AISI Mulai Pelajari Dampak Resesi Terhadap Penjualan Sepeda Motor Indonesia ,Negatif
 KomisiAndaElshinta jenis bahan pangan yang termasuk dalam golongan Cadangan Pangan Pemerintah CPP akan dikuasai dan dikelola oleh pemerintah mampukah tingkatkan ketahanan ekonomi Indonesia tengah ancaman resesi global nStreaming ,Negatif
 Yang katanya tahun depan mau ada resesi global hape puluhan juta tetep ajah laris kayak kacang goreng nIndonesia ,Negatif
 Ini upaya kaum pencinta hoak dalam menwujudkan RESESI dunia agar Indonesia kena imbasnya Jahat kalian para kaum kadrun ,Negatif
 Krisis energy jerman ternyata engak juga tuh semoga semi resesi indonesia juga segera berakhir yaa ,Negatif
 Indonesia patut bersyukur karena tengah krisis dan resesi yang melanda dunia saat ini perekonomian Indonesia kuartal masih bisa tumbuh dengan baik dan tertinggi antara negara negara ,Negatif
 DiskusiInteraktifElshinta jenis bahan pangan yang termasuk dalam golongan Cadangan Pangan Pemerintah CPP akan dikuasai dan dikelola oleh pemerintah mampukah tingkatkan ketahanan ekonomi Indonesia tengah ancaman resesi global nTalk Pengamat Ekonomi Irwan Ibrahim ,Negatif
 MESKI ada ancaman resesi perekonomian global tahun depan Unilever Indonesia Tbk UNVR optimistis penjualan produk akan bertumbuh Perseroan tersebut menargetkan pertumbuhan kisaran ,Negatif
 Ditengah Himpitan Ancaman Resesi Mercy Maybach Mewah Miliar Ludes Diborong Orang Indonesia Paling Banyak Beli Cash ,Negatif
 DiskusiInteraktifElshinta jenis bahan pangan yang termasuk dalam golongan Cadangan Pangan Pemerintah CPP akan dikuasai dan dikelola oleh pemerintah mampukah tingkatkan ketahanan ekonomi Indonesia tengah ancaman resesi global ,Negatif
 Rantai pasokan menjadi momok dan biang kerok Resesi Ekonomi Indonesia JokowiGasPolPemulihanEkonomi ,Negatif
 Resesi Global Mengancam Indonesia Diprediksi Masih Bisa Bertahan ,Negatif
 Indonesia dengan karunia sda Tuhan luar biasa perlu dikelola dengan sebaik mungkin agar apa terjadi Eropa tidak dialami oleh Indonesia Kuncinya adalah seberapa serius pemerintah melakukan upaya prefentif terhadap ancaman resesi ini ,Negatif
 Resesi kini terjadi sebagian negara Eropa dirasa kian mengancam negara Asia termasuk Indonesia dilaporkan Inggris diketahui stok pangan makin sulit akibat harga meroket ,Negatif
 Indonesia Terancam Resesi Andi Arief Apa yang Bisa Dilakukan Pak Jokowi Sisa Kekuasannya nJokowi Gancit Cebong Hasil Tes Otak BNPT Nikita Mirzani Guling Tidur LeoNiel Gen yoona BapakPewarisUtang ceweksange MegaDikudeta AniesPresiden ,Negatif
 Bukan saja Indonesia resesi akan terjadi secara global nItulah plan mereka nWASPADA ,Negatif
 badai resesi hanya nimpa Indonesia tapi seluruh dunia maka dari itu butuh kerjasama semua pihak supaya Indonesia tidak masuk resesi jgn cuma pemerintah kan ,Negatif
 Mendag Sebut Ada Potensi Besar Indonesia Tengah Ancaman Resesi Dunia Apa Itu ,Negatif
 FAKKTA Tak Resesi Bukan Berarti Indonesia Baik Baik Saja ,Negatif
 Resesi ekonomi Amerika belum tentu jadi resesi Indonesia Amerika tidak resesi juga tidak lalu artinya Indonesia akan tidak resesi nRibet kalau dengerinnya Menkeu sekarang lebih banyak bicara ekonomi global daripada nasional Diskursusnya jadi membingungkan ,Negatif
 Resesi Ekonomi Amerika itu beda dengan resesi Indonesia Penyebabnya beda variabelnya berbeda dan tentu efeknya berbeda nBingung juga dengerin Menkeu sepertinya lebih banyak bicara Amerika daripada Indonesia ,Negatif
 Presiden Direktur Unilever Indonesia Ira Noviarti memprediksi sektor FMCG masih bisa tumbuh hingga persen tengah ancaman resesi global ,Negatif
 Daya konsumsi masyarakat besar Staf Ahli Menkop UKM Eddy Satria prediksi UMKM akan selamatkan Indonesia dari ancaman resesi TempoBisnis ,Negatif
 Dalam situasi dunia sedang dilanda resesi akibat pandemi Indonesia dapat bertahan itu sebuah perjuangan yang luar biasa nKalian demokrat hanya bisa melihat dari sisi yang kalianpun tak akan sanggup mengatasinya jangan pamer ketololan ,Negatif
 Yuk intip suasan pertemuan Pemerintah dan dalam membangun perekonomian indonesia menjadi semakin membaik dalam menghadapi krisis global airlanggahartarto golkar krisisglobal resesi ,Negatif
 Ekonom Yakin Indonesia Tak Terkena Resesi Tahun Berikut Beberapa Alasannya ,Negatif
 Pemerintah Indonesia akan menyasar pasar ekspor Asia Selatan Asia Tengah hingga Timur Tengah sebagai antisipasi resesi TempoBisnis ,Negatif
 Indonesia Terancam Resesi Andi Arief Apa yang Bisa Dilakukan Pak Jokowi Sisa Kekuasannya ,Negatif
 Saya berani mengatakan ketika orang berkata akan terjadi resesi global Indonesia mungkin ada pelambatan kata Poltak Hotradero ,Negatif
 Ancaman resesi ekonomi depan mata kita Walaupun ada beberapa pengamat yang mengatakan Indonesia akan kuat menghadapi resesi akan lebih baik sedia payung sebelum hujan resesi ekonomi ReferensiTeruji infografis Validnews ,Negatif
 Beneran beliau percaya Indonesia gak resesi karena sejauh ini kita diuntungkan ketika eropa krisis energi nSingkatnya eropa krisis karena Rusia Indonesia manfaatin itu dengan jual batubara mahal Eropa susah makan kita duduk santai kipas kipas pake dollar hasil jualan ,Negatif
 Pak Prabowo Indihome Nikita Mirzani Resesi Indonesia Nostradamus ,Negatif
 Kanwil Kemenkumham Sumsel Menkumham yang menyebabkan Indonesia dapat ter expose dengan resiko global seperti inflasi resesi kompetisi politik hingga efek domino dari pandemi Covid KumhamSumsel HarunSulianto BapasLahat ,Negatif
 Setuju setidaknya isu resesi tahun juga dapat tepis papua bahkan indonesia ,Negatif
 welcome resesi menghantam negara kita sampai dimana kekuatanmu menghancurkan ekonomi Indonesia ingat ada jokowi dan kerbonya jadikanlah para cebong perisai negara ini ,Negatif
 The Indonesia Summit Bahas Strategi dan Peluang Hadapi Ancaman Resesi ,Negatif
 kata kadrun indonesia lagi darurat resesi ekonomi ,Negatif
 Gue percaya Indonesia bkl kena resesi ,Negatif
 Indonesia Sudah Siap Hadapi Ancaman Resesi Global ,Negatif
 Resesi Global Ancam Indonesia Awalil Rizky Empat Negara diprediksi Mampus Hadapi Guncangan Resesi Dunia ,Negatif
 Ancaman Resesi TPFx Indonesia Luncurkan Trading Central Alpha Generation ,Negatif
 Ninasapti Triaswati sebagai pembicara ketiga menjelaskan tentang faktor yang membuat Indonesia jatuh dalam resesi Tapi tetap harapannya agar resesi tersebut tidak terjadi ,Negatif
 Poltak menjelaskan faktor lain yang membuat Indonesia sulit untuk masuk dalam resesi karena sektor ekonomi Indonesia itu sangat lokal sekali ,Negatif
 Bisnis kuliner menjadi salah satu yang terkena dampak dari mewabahnya virus corona Indonesia Selain karena menurunnya penjualan beberapa bisnis bahkan terpaksa harus gulung tikar akibat dari resesi ,Negatif
 Dunia Dibayangi Resesi Mendag Ingin Indonesia Ambil Peluang ,Negatif
 pasti demo itu RUU perampasan aset koruptor kalau mahasiswa harusnya tau resesi bukan cuman Indonesia ,Negatif
 Kanwil Kemenkumham Sumsel Menkumham yang menyebabkan Indonesia dapat ter expose dengan resiko global seperti inflasi resesi kompetisi politik hingga efek domino dri pandemi Covid KumhamSumsel LPMuaraenim HarunSulianto ,Negatif
 SBY Resesi dunia akan berdampak kepada Indonesia ,Negatif
 Itu karena kita ada batu bara kalau gak ada semuanya NAIK seperti BBM dan akhirnya INFLASI xef RESESI nIndonesia masih berpotensi RESESI jangan puji tanpa teruji kita tunggu lewati Apakah Indonesia kena resesi atau tidak ,Negatif
 Bukan Krisis Ekonomi Inilah Ancaman bagi Bisnis Tembakau Jember nJember Resesi dan krisis ekonomi tengah mengancam Indonesia Tetapi bagi pelaku bisnis Ekbis BupatiHendySiswanto CerutuJember FCTC via ,Negatif
 Salah satu alasan mengapa Indonesia tidak terkena dampak Resesi adalah karena kebijakan Jokowi yang sangat menguntungkan Indonesia ,Negatif
 TUR Karikatur nKep Indonesia Tur militer makin galak Pacifik nNelayan asing bernafsu perairan Natuna curi ikan tuna Australia incar Pasir nInflasi tinggi nSemua negara siap diuji RESESI GLOBAL Putin action XiJinping BidenDeliversAGAIN ,Negatif
 Indonesia dan Resesi ,Negatif
 Kanwil Kemenkumham Sumsel Menkumham yang menyebabkan Indonesia dapat ter expose dengan resiko global seperti inflasi resesi kompetisi politik hingga efek domino dari pandemi Covid BapasMuratara KumhamSumsel ,Negatif
 Baru banget Salah relasi kerja bos gede surabaya Gudangnya Gede pake banget Supply daerah Surabaya dan skitarnya kalimantan sulawesi Indonesia Timur dan luar negri kayaknya Hadapi resesi ambil opsi ngurangin gudang ,Negatif
 Ini solusi utk menghadapi dan pencegahan resesi Indonesia SBY bilang begini asal semua negara lain upayakan tdk resesi maka Indonesia tdk akan resesi Atau bahasa kasarnya begini kita tunggu dan tunggu Mudah negara lain tdk resesi kita pun aman nDasar bego ,Negatif
 Cargill Indonesia Cocoa and Chocolate optimistis ungkap cara menghindari resesi global yang diprediksi tahun mendatang nBaca PTCarg ,Negatif
 Meskipun pemerintah optimistis Indonesia memiliki secercah harapan tengah ancaman resesi global pada dampak dari gelapnya situasi dunia dapat berimbas hingga dalam negeri Salah satu dampaknya adalah ancaman badai PHK ,Negatif
 Hadeeh bapak udah tahu mau memasuki resesi ngapain juga berobat jauh biayanya tanggung negara membebani apbn emang indonesia tak bisa kah atau ada misi lain amrik mana dibawa satu kelurahan cikeas lagi termasuk tukang sabit rumput kebo ,Negatif
 tengah ancaman resesi dunia daya tarik investasi Indonesia terbukti masih sangat tinggi Ini memberikan optimisme perekonomian depannya masih akan kuat investor asing memandang Indonesia sebagai surga investasi resesi ekonomi inflasi Indonesia ,Negatif
 Kabar Jombang Indonesia Bisa Selamat dari Resesi Ini Tanda Tandanya ,Negatif
 Lagi coba belajar hal baru ekonomi nLagi rajin dengerin para pakar berbicara ttg resesi global dan pengaruhnya pada Indonesia Hasilnya xab xab xab nOmongan apa ini sama sekali gak ada sempat nyantol kepalaku xad istilah nya aja gak mudeng xad xad nOke ,Negatif
 Dan setauku APBN Indonesia itu tahun ini lumayan tebel makanya kemungkinan buat resesi seperti negara lain itu kecil ,Negatif
 Negara Bakal Masuk Krisis Utang Indonesia Termasuk lewat resesi covid jangan takut kita mesti bisa berteman dengan resesi ,Negatif
 Bukan sepertinya lagi pak seluruh ekonom dunia sudah memastikan resesi global nIndonesia apresiasi dunia akan mampu menahan resesi global ,Negatif
 Ngomong apa kamu dul nCoba bantu pemerintah memikirkan gimana caranya Indonesia dalam menghadapi ancaman resesi nBukannya ngoceh ngalur ngidul gak jelas rugi negara dengan adanya manusia kamu ini ,Negatif
 Melansir CNBC Indonesia Menteri Keuangan Sri Mulyani usai pertemuannya dengan Gubernur Bank Central Negara mengatakan bahwa negara dengan tumpukan utang akan sulit menghadapi situasi dunia yang alami berbagai krisis hingga berujung pada resesi Lanjut xac xef ,Negatif
 Indonesia mungkin klo dunia Saya yakin klo resesi ,Negatif
 Bagaimanakah Prediksi Resesi Indonesia Tahun Depan xiaomi redmi poco miui android google xiaomiintro smartphone apps ,Negatif
 Indonesia Tengah Ancaman Resesi Global ,Negatif
 Pemerintah menyampaikan bahwa cepat atau lambat Indonesia berpotensi mengalami resesi keuangan Lalu apa dampaknya pada finansial rumah tangga Yuk simak ,Negatif
 Berharap resesi tidak menghampiri Indonesia Tapi letidakbecusan rezim Itu pasti ,Negatif
 Pos Indonesia yakin industri logistik kuat hadapi ancaman resesi ,Negatif
 pak usa mikirin resesi global nBiar pak Jokowi aja mikir nKalo anda mengahadapi resesi global ini nBisa jadi indonesia jadi milik Amerika nJadi biar bapak paham nDiem aja rumah ngelukis sama buat lagu atau setidaknya ajarin ahy gmn kerasnya dunia politik ,Negatif
 Resesi Ancam Dunia Amankah Indonesia dari Hantu Stagflasi ,Negatif
 Betul pak seenggaknya paling cuman butuh brp ribu mati kelaparan rakyat masih sisa ratusan juta semoga resesi tdk benar indonesia amin ,Negatif
 Tanda tanda resesi ekonomi Indonesia sudah semakin nampak bentuk keadaan nya ,Negatif
 Mungkin banyak yang lupa pada sejatinya sudah terjadi resesi dunia karena pandemi COVID Termasuk Indonesia mengalaminya Sehingga ada pengalaman yang berguna untuk menangkal terulangnya resesi Kata Deputy Director Institute for ,Negatif
 resesi itu memang masuk akal mungkin indonesia kena dampaknya klo bikin konten tntng itu usah dilebih lebihkan lah namanya scaremongering anying ,Negatif
 The Indonesia Summit Rebuild the Economy Bahas Strategi Saat Alarm Resesi Global Mulai Berbunyi ,Negatif
 negara dunia ini mengalami gejolak ekonomi alias terancam resesi sedangkan negara kita masih aman soalnya saya yakin rakyat indonesia sebagian mempunyai jiwa petarung dan manja ,Negatif
 Cargill Indonesia Cocoa and Chocolate optimistis ungkap cara menghindari resesi global yang diprediksi tahun mendatang JatimNow PTCargillIndonesia kakao coklat Manufaktur Gresik ,Negatif
 Tsu gak sih bang Klo gini caranya bahkan kerjaan swasta adanya outsourcing palagi BUMN eksploitasi nya paling tinggi Dan klo pendapatan orang Indonesia kecil semua gini tanpa adanya ancaman resesi global ato sampek beberapa dekade jelas bisa resesi sendirinya ,Negatif
 Saya pikir sederhana pak Jendral Jika saja sluruh oerdagangan kembali mata uang perak dan emas sebagai alat pembayaran tak ada resesi Emas karat Indonesia karat Uang kertas adlh uang bisa dipermainkan berfluktuasi ,Negatif
 gaspol pemulihan ekonomi nMenteri keuangan Sri Mulyani Indrawati mengatakan rantai pasokan biang kerok resesi ekonomi Indonesia Indonesia mencoba mengatasi inflasi dari akar masalahnya yaitu rantai pasokan upaya itu melalui kolaborasi tim pengendalian inflasi ,Negatif
 Makanya jawab erik tohir dan ekonom ancaman resesi dunia bukan berarti berlaku untuk Indonesia drun ada faktor pergantian masa jabatan presiden dari jokowi next jokowi Indonesia harus memilih calon presiden dapat melanjutkan pembangunan IKN Paham drun ,Negatif
 Generasi terkuat Indonesia kayanya kelahiran tahun Lahir waktu krisis lulus kuliah waktu pandemi dan taun kemudian disambut resesi Pukpuk sing kuat dek ndari aku baru ngereject satu cumlaude PTN dan satu lulusan terbaik PTS Duh hatiku ,Negatif
 Dalam sambutannya Menkumham menyampaikan bahwa saat ini Indonesia merupakan bagian dari masyarakat internasional yang terlibat dalam manajemen global yang menyebabkan Indonesia dapat ter expose dengan resiko global seperti inflasi resesi kompetisi politik ,Negatif
 Betul pak mohon Kader bapak rajin nongol medsos dikasih juga pencerahan bahwa situasi sulit dialami Indonesia saat ini adalah imbas dari pengaruh resesi global ,Negatif
 Konon seluruh neg dunia akan merasakan resesi tdk terkecuali Indonesia Indonesia ditangan Presiden Jokowi akan mampu melewati badai resesi apabila rakyat dan negarawan spt bapak mendukung pemerintah ,Negatif
 Indonesia resesi dek kadrun kadrun ngarep Indonesia resesi ,Negatif
 Kesimpulannya resesi tidak berdampak signifikan hanya saja perkembangan ekonomi Indonesia melambat Dan apabila ekonomi kembali pulih untuk kembali normal Indonesia memerlukan waktu yang cukup lama nApa yang harus diperbuat ,Negatif
 jabatannya sebelumnya diisi Boris Johnson setelah hari menjabat karena tidak mampu menangani perekonomian Inggris Dan resmi baru saja kemarin Rishi Sunak diangkat menjadi Inggris nApakah resesi menakutkan bagi Indonesia ,Negatif
 September saya pernah membuat story merespon mengenai menakutkannya resesi Indonesia akibat korona Pemerintah saat itu membuat kebijakan tepat sehingga resesi mampu ditangani Walaupun memang ada problem ekonomi pengaruhnya tidak begitu signifikan ,Negatif
 Skrg presidenci presiden orang indonesia blm pernah bhkn asia tenggara juga blm pernah ada Tuk Memimpin lbih thun Negara maju Hutang baru dari Kttpan kinstitusi Inggris jeman skrg pailit resesi ekonomi indonsia stgnan aman kami rkyt brskur ,Negatif
 Menkumham menyampaikan bahwa saat ini Indonesia merupakan bagian dari masyarakat internasional yang terlibat dalam manajemen global yang menyebabkan Indonesia dapat ter expose resiko global seperti inflasi resesi kompetisi politik hingga efek domino dari pandemi Covid ,Negatif
 Menkumham menyampaikan bahwa saat ini Indonesia merupakan bagian dari masyarakat internasional yang terlibat dlm manajemen global yang menyebabkan Indonesia dapat ter expose dengan resiko global seperti inflasi resesi kompetisi politik hingga efek domino dari pandemi Covid ,Negatif
 Halo Sobat BUMN nMuhamad Chatib Basri Resesi artinya kita mengalami pertumbuhan ekonomi negatif saya tidak melihat ada kemungkinan untuk Indonesia mengalami pertumbuhan ekonomi negatif mungkin hanya akan terjadi perlambatan ekonomi BUMNUntukG SOEInternationalConference ,Negatif
 Namun pertanian Indonesia mampu memperkuat perekonomian dan membawa Indonesia tidak terseret dalam jurang resesi petani sebagai aktor utama dalam pembangunan pertanianian membutuhkan peran ,Negatif
 Yang menyebabkan Indonesia dapat ter expose dengan resiko global seperti inflasi resesi kompetisi politik hingga efek domino dari pandemi Covid nKemenkumham Gorontalo nHeni Susila Wardoyo ,Negatif
 Setiap hari lihat mobil mewah jalanan Tentunya hal ini menandakan bahwa semakin banyak orang kaya Indonesia dan sepertinya tak peduli itu pandemi atau resesi Kesederhanaan dan kepedulian hanya tai ledig ,Negatif
